{"schema_version":"1.0","profile_id":"LS-AUTHORITY-PROFILE-FIXTURE-UNBOUND","profile_version":"1.0-fixture","effective_at":"2026-10-04T00:00:00Z","binding_status":"BINDING_REQUIRED","issuer_allowlist":[],"role_permissions":[{"canonical_role":"DATA_CONTRIBUTOR","allowed_actions":["SUBMIT_SOURCE_EVIDENCE_DELTA"],"scope_rule":"ASSIGNED_SKU_ONLY"},{"canonical_role":"PRODUCT_OWNER","allowed_actions":["READ_ACTIVE_PASSPORT"],"scope_rule":"AUTHORIZED_SKU_SCOPE"},{"canonical_role":"PRODUCT_OWNER_WITH_RECREATE_AUTHORITY","allowed_actions":["RECREATE_PASSPORT"],"scope_rule":"AUTHORIZED_SKU_SCOPE"},{"canonical_role":"PASSPORT_ADMIN","allowed_actions":["RESTORE_ARCHIVED_PASSPORT"],"scope_rule":"ADMINISTRATIVE_SCOPE"},{"canonical_role":"AUDITOR","allowed_actions":["READ_ARCHIVE"],"scope_rule":"AUTHORIZED_SKU_SCOPE"},{"canonical_role":"LEGAL_OWNER","allowed_actions":["APPLY_LEGAL_HOLD"],"scope_rule":"HOLD_SCOPE_ONLY"},{"canonical_role":"AUDIT_OWNER","allowed_actions":["APPLY_LEGAL_HOLD"],"scope_rule":"HOLD_SCOPE_ONLY"}],"idp_bindings":[],"configured_by":"FIXTURE","approved_by":"FIXTURE","profile_sha256":"aaaaaaaaaaaaaaaaaaaaaaaaaaaaaaaaaaaaaaaaaaaaaaaaaaaaaaaaaaaaaaaa"}
